<?xml version="1.0" encoding="UTF-8"?>

<clientes xsi:noNamespaceSchemaLocation="clientes.xsd" xmlns:xsi="http://www.w3.org/2001/XMLSchema-instance">
	<cliente>
		<apellido>aaaaaaaaaaaaaaaaaaaa</apellido>
		<apellido>aaaaaaaaaaaaaaaaaaaa</apellido>
		<direccion>
			<calle>aaaaaaaaaaaaaaaaaaaaaaaaaaaaaa</calle>
			<numero>aaaaaaaaaaaaaaaaaaaaaaaaaaaaaa</numero>
			<piso>0</piso>
			<escalera>c</escalera>
			<cp>12345</cp>
			<ciudad>aaaaaaaaaaaaaaaaaaaaaaaaaaaaaa</ciudad>
		</direccion>
		<direccion>
			<calle>aaaaaaaaaaaaaaaaaaaaaaaaaaaaaa</calle>
			<numero>aaaaaaaaaaaaaaaaaaaaaaaaaaaaaa</numero>
			<piso>0</piso>
			<escalera>a</escalera>
			<cp>12345</cp>
			<ciudad>aaaaaaaaaaaaaaaaaaaaaaaaaaaaaa</ciudad>
		</direccion>
		<direccion>
			<calle>aaaaaaaaaaaaaaaaaaaaaaaaaaaaaa</calle>
			<numero>aaaaaaaaaaaaaaaaaaaaaaaaaaaaaa</numero>
			<piso>0</piso>
			<escalera>b</escalera>
			<cp>12345</cp>
			<ciudad>aaaaaaaaaaaaaaaaaaaaaaaaaaaaaa</ciudad>
		</direccion>
		<telefono>aaaaaaaaaaaaaaaaaaaa</telefono>
		<nombre>String</nombre>
	</cliente>
	<cliente>
		<apellido>aaaaaaaaaaaaaaaaaaaa</apellido>
		<apellido>aaaaaaaaaaaaaaaaaaaa</apellido>
		<direccion>
			<calle>aaaaaaaaaaaaaaaaaaaaaaaaaaaaaa</calle>
			<numero>aaaaaaaaaaaaaaaaaaaaaaaaaaaaaa</numero>
			<piso>0</piso>
			<escalera>b</escalera>
			<cp>12345</cp>
			<ciudad>aaaaaaaaaaaaaaaaaaaaaaaaaaaaaa</ciudad>
		</direccion>
		<direccion>
			<calle>aaaaaaaaaaaaaaaaaaaaaaaaaaaaaa</calle>
			<numero>aaaaaaaaaaaaaaaaaaaaaaaaaaaaaa</numero>
			<piso>0</piso>
			<escalera>c</escalera>
			<cp>12345</cp>
			<ciudad>aaaaaaaaaaaaaaaaaaaaaaaaaaaaaa</ciudad>
		</direccion>
		<direccion>
			<calle>aaaaaaaaaaaaaaaaaaaaaaaaaaaaaa</calle>
			<numero>aaaaaaaaaaaaaaaaaaaaaaaaaaaaaa</numero>
			<piso>0</piso>
			<escalera>b</escalera>
			<cp>12345</cp>
			<ciudad>aaaaaaaaaaaaaaaaaaaaaaaaaaaaaa</ciudad>
		</direccion>
		<telefono>aaaaaaaaaaaaaaaaaaaa</telefono>
		<nombre>String</nombre>
	</cliente>
	<cliente>
		<apellido>aaaaaaaaaaaaaaaaaaaa</apellido>
		<apellido>aaaaaaaaaaaaaaaaaaaa</apellido>
		<direccion>
			<calle>aaaaaaaaaaaaaaaaaaaaaaaaaaaaaa</calle>
			<numero>aaaaaaaaaaaaaaaaaaaaaaaaaaaaaa</numero>
			<piso>0</piso>
			<escalera>c</escalera>
			<cp>12345</cp>
			<ciudad>aaaaaaaaaaaaaaaaaaaaaaaaaaaaaa</ciudad>
		</direccion>
		<direccion>
			<calle>aaaaaaaaaaaaaaaaaaaaaaaaaaaaaa</calle>
			<numero>aaaaaaaaaaaaaaaaaaaaaaaaaaaaaa</numero>
			<piso>0</piso>
			<escalera>c</escalera>
			<cp>12345</cp>
			<ciudad>aaaaaaaaaaaaaaaaaaaaaaaaaaaaaa</ciudad>
		</direccion>
		<direccion>
			<calle>aaaaaaaaaaaaaaaaaaaaaaaaaaaaaa</calle>
			<numero>aaaaaaaaaaaaaaaaaaaaaaaaaaaaaa</numero>
			<piso>0</piso>
			<escalera>b</escalera>
			<cp>12345</cp>
			<ciudad>aaaaaaaaaaaaaaaaaaaaaaaaaaaaaa</ciudad>
		</direccion>
		<telefono>aaaaaaaaaaaaaaaaaaaa</telefono>
		<nombre>String</nombre>
	</cliente>
</clientes>
